{
  "per_criterion": [
    {
      "name": "Task Response (TR)",
      "band": 7.5,
      "evidence_quotes": [
        "While some argue this requirement would be beneficial, I partially agree with this proposition, believing that voluntary participation would be more effective than compulsion.",
        "In conclusion, while community service offers valuable learning experiences and social benefits, making it compulsory may diminish its intended impact."
      ],
      "errors": [],
      "suggestions": [
        "Clarify the extent of agreement in the introduction.",
        "Provide more specific examples of community service activities.",
        "Expand on the potential benefits of voluntary participation."
      ]
    },
    {
      "name": "Coherence & Cohesion (CC)",
      "band": 7.0,
      "evidence_quotes": [
        "On the one hand, mandatory community service could provide numerous benefits to both students and society.",
        "On the other hand, forcing students to participate in community service may have counterproductive effects."
      ],
      "errors": [],
      "suggestions": [
        "Use more varied cohesive devices to enhance flow.",
        "Ensure each paragraph has a clear topic sentence.",
        "Link ideas more explicitly between paragraphs."
      ]
    },
    {
      "name": "Lexical Resource (LR)",
      "band": 8.0,
      "evidence_quotes": [
        "foster a sense of social responsibility",
        "develop empathy and understanding of diverse social issues",
        "potentially developing negative attitudes toward volunteering"
      ],
      "errors": [],
      "suggestions": [
        "Incorporate more advanced vocabulary.",
        "Avoid repetition of common phrases.",
        "Use synonyms to enhance lexical variety."
      ]
    },
    {
      "name": "Grammatical Range & Accuracy (GRA)",
      "band": 7.0,
      "evidence_quotes": [
        "students might view them as mere obligations rather than meaningful contributions",
        "adding compulsory service to already demanding academic schedules could increase stress levels"
      ],
      "errors": [
        {
          "span": "students might view them as mere obligations rather than meaningful contributions",
          "type": "grammar",
          "fix": "Consider revising for clarity."
        }
      ],
      "suggestions": [
        "Vary sentence structures more frequently.",
        "Ensure subject-verb agreement is consistently accurate.",
        "Minimize the use of passive voice."
      ]
    }
  ],
  "overall": 7.5,
  "votes": [
    7.5,
    7.5,
    7.5
  ],
  "dispersion": 0.0,
  "confidence": "high",
  "meta": {
    "prompt_hash": "e8a4aa36b40fd46f65effde3586c5ef5a43029383656cae789aef831d9f6d05f",
    "model": "gpt-4o-mini",
    "schema_version": "v1",
    "rubric_version": "rubric/v1",
    "token_usage": {
      "input_tokens": 2238,
      "output_tokens": 1536
    }
  }
}